{
  "schema_version": "amy.artifact-retention-policy.v1",
  "classification": "retention_and_distribution_policy_not_scientific_evidence",
  "tree_hash_algorithm": "sha256-rfc8785-member-tree-v1",
  "retained_roots": [
    "audit",
    "pilot_runs",
    "base_pilot_runs",
    "selected_profile_base_runs",
    "production_pilot_runs",
    "robustness_runs",
    "reviews"
  ],
  "artifacts": [
    {
      "id": "ART-AUDIT-AMY-RAW-20260713",
      "family": "audit",
      "path": "audit/AMY_DEEP_AUDIT_RAW_2026-07-13.json",
      "kind": "file",
      "status": "historical_valid",
      "validator": {
        "kind": "executable",
        "path": "scripts/validate_amy_audit.py",
        "invocation": "python scripts/validate_amy_audit.py"
      },
      "reason": "Dated read-only A.M.Y snapshot retained with its original validation; later source drift means it is historical, not current.",
      "source_git": true,
      "public_packet": false
    },
    {
      "id": "ART-AUDIT-AMY-VALIDATION-20260713",
      "family": "audit",
      "path": "audit/AMY_DEEP_AUDIT_VALIDATION_2026-07-13.json",
      "kind": "file",
      "status": "historical_valid",
      "validator": {
        "kind": "executable",
        "path": "scripts/validate_amy_audit.py",
        "invocation": "python scripts/validate_amy_audit.py"
      },
      "reason": "Original same-environment replay record for the dated A.M.Y audit; retained without representing the present worktree.",
      "source_git": true,
      "public_packet": false
    },
    {
      "id": "ART-AUDIT-AMY-PAPER-REPORT-20260713",
      "family": "audit",
      "path": "audit/AMY_SYSTEM_PAPER_CODE_DATA_PDF_AUDIT_2026-07-13.md",
      "kind": "file",
      "status": "historical_valid",
      "validator": {
        "kind": "pytest",
        "path": "tests/test_system_paper_integrity_audit.py",
        "invocation": "pytest -q tests/test_system_paper_integrity_audit.py"
      },
      "reason": "Human-readable report bound to the dated system-paper audit and retained as historical analysis rather than current evidence.",
      "source_git": true,
      "public_packet": false
    },
    {
      "id": "ART-AUDIT-AMY-PAPER-RAW-20260713",
      "family": "audit",
      "path": "audit/AMY_SYSTEM_PAPER_DEEP_AUDIT_RAW_2026-07-13.json",
      "kind": "file",
      "status": "historical_valid",
      "validator": {
        "kind": "executable",
        "path": "scripts/validate_system_paper_audit.py",
        "invocation": "python scripts/validate_system_paper_audit.py"
      },
      "reason": "Dated machine-readable system-paper snapshot preserved with explicit historical scope and no current-byte claim.",
      "source_git": true,
      "public_packet": false
    },
    {
      "id": "ART-AUDIT-AMY-PAPER-VALIDATION-20260713",
      "family": "audit",
      "path": "audit/AMY_SYSTEM_PAPER_DEEP_AUDIT_VALIDATION_2026-07-13.json",
      "kind": "file",
      "status": "historical_valid",
      "validator": {
        "kind": "executable",
        "path": "scripts/validate_system_paper_audit.py",
        "invocation": "python scripts/validate_system_paper_audit.py"
      },
      "reason": "Original canonical replay result for the dated system-paper audit, retained without retroactive rewriting.",
      "source_git": true,
      "public_packet": false
    },
    {
      "id": "ART-AUDIT-ATLAS-RAW-20260713",
      "family": "audit",
      "path": "audit/ATLAS_DEEP_AUDIT_RAW_2026-07-13.json",
      "kind": "file",
      "status": "historical_valid",
      "validator": {
        "kind": "executable",
        "path": "scripts/validate_protocol.py",
        "invocation": "python scripts/validate_protocol.py"
      },
      "reason": "Dated ATLAS code-and-artifact snapshot retained as historical audit input; current source bytes are outside its claim.",
      "source_git": true,
      "public_packet": false
    },
    {
      "id": "ART-AUDIT-ATLAS-VALIDATION-20260713",
      "family": "audit",
      "path": "audit/ATLAS_DEEP_AUDIT_VALIDATION_2026-07-13.json",
      "kind": "file",
      "status": "historical_valid",
      "validator": {
        "kind": "executable",
        "path": "scripts/validate_protocol.py",
        "invocation": "python scripts/validate_protocol.py"
      },
      "reason": "Original same-environment validation for the dated ATLAS snapshot; it is retained as provenance, not a current replay.",
      "source_git": true,
      "public_packet": false
    },
    {
      "id": "ART-AUDIT-ATLAS-REPORT-20260713",
      "family": "audit",
      "path": "audit/ATLAS_DEEP_CODE_AND_ARTIFACT_AUDIT_2026-07-13.md",
      "kind": "file",
      "status": "historical_valid",
      "validator": {
        "kind": "retention_only",
        "path": "scripts/build_artifact_retention_index.py",
        "invocation": "python scripts/build_artifact_retention_index.py --check"
      },
      "reason": "Human-readable ATLAS findings retained with the dated snapshot and bounded to that historical code state.",
      "source_git": true,
      "public_packet": false
    },
    {
      "id": "ART-AUDIT-AXIOM-RAW-20260713",
      "family": "audit",
      "path": "audit/AXIOM_DEEP_AUDIT_RAW_2026-07-13.json",
      "kind": "file",
      "status": "historical_valid",
      "validator": {
        "kind": "executable",
        "path": "scripts/validate_axiom_audit.py",
        "invocation": "python scripts/validate_axiom_audit.py"
      },
      "reason": "Dated AXIOM boundary and artifact snapshot retained as historical evidence of the state actually inspected.",
      "source_git": true,
      "public_packet": false
    },
    {
      "id": "ART-AUDIT-AXIOM-VALIDATION-20260713",
      "family": "audit",
      "path": "audit/AXIOM_DEEP_AUDIT_VALIDATION_2026-07-13.json",
      "kind": "file",
      "status": "historical_valid",
      "validator": {
        "kind": "executable",
        "path": "scripts/validate_axiom_audit.py",
        "invocation": "python scripts/validate_axiom_audit.py"
      },
      "reason": "Original canonical validation for the dated AXIOM audit; retained without claiming current-worktree equivalence.",
      "source_git": true,
      "public_packet": false
    },
    {
      "id": "ART-AUDIT-AXIOM-REPORT-20260713",
      "family": "audit",
      "path": "audit/AXIOM_DEEP_CODE_ARTIFACT_AND_PAPER_AUDIT_2026-07-13.md",
      "kind": "file",
      "status": "historical_valid",
      "validator": {
        "kind": "pytest",
        "path": "tests/test_axiom_integrity_audit.py",
        "invocation": "pytest -q tests/test_axiom_integrity_audit.py"
      },
      "reason": "Human-readable AXIOM report retained with the machine-readable dated audit and its bounded historical interpretation.",
      "source_git": true,
      "public_packet": false
    },
    {
      "id": "ART-AUDIT-BASELINE-20260713",
      "family": "audit",
      "path": "audit/BASELINE_AUDIT_2026-07-13.md",
      "kind": "file",
      "status": "historical_valid",
      "validator": {
        "kind": "retention_only",
        "path": "scripts/build_artifact_retention_index.py",
        "invocation": "python scripts/build_artifact_retention_index.py --check"
      },
      "reason": "Initial exploratory baseline retained to document the design chronology; it is not the current project assessment.",
      "source_git": true,
      "public_packet": false
    },
    {
      "id": "ART-AUDIT-MANUSCRIPTS-REPORT-20260713",
      "family": "audit",
      "path": "audit/LATEST_MANUSCRIPTS_CODE_DATA_PDF_AND_REFERENCE_AUDIT_2026-07-13.md",
      "kind": "file",
      "status": "historical_valid",
      "validator": {
        "kind": "pytest",
        "path": "tests/test_latest_manuscripts_audit.py",
        "invocation": "pytest -q tests/test_latest_manuscripts_audit.py"
      },
      "reason": "Human-readable manuscript admissibility report retained with its dated inputs and without a claim about current manuscript bytes.",
      "source_git": true,
      "public_packet": false
    },
    {
      "id": "ART-AUDIT-MANUSCRIPTS-RAW-20260713",
      "family": "audit",
      "path": "audit/LATEST_MANUSCRIPTS_DEEP_AUDIT_RAW_2026-07-13.json",
      "kind": "file",
      "status": "historical_valid",
      "validator": {
        "kind": "executable",
        "path": "scripts/validate_latest_manuscripts_audit.py",
        "invocation": "python scripts/validate_latest_manuscripts_audit.py"
      },
      "reason": "Dated manuscript source-to-claim snapshot preserved as a historical record despite later source drift.",
      "source_git": true,
      "public_packet": false
    },
    {
      "id": "ART-AUDIT-MANUSCRIPTS-VALIDATION-20260713",
      "family": "audit",
      "path": "audit/LATEST_MANUSCRIPTS_DEEP_AUDIT_VALIDATION_2026-07-13.json",
      "kind": "file",
      "status": "historical_valid",
      "validator": {
        "kind": "executable",
        "path": "scripts/validate_latest_manuscripts_audit.py",
        "invocation": "python scripts/validate_latest_manuscripts_audit.py"
      },
      "reason": "Original same-environment replay result for the dated manuscript audit; not evidence that present bytes match.",
      "source_git": true,
      "public_packet": false
    },
    {
      "id": "ART-AUDIT-RELEASE-IDENTITY-20260713",
      "family": "audit",
      "path": "audit/RELEASE_IDENTITY_VERSION_SHA_SIGNATURE_AUDIT_2026-07-13.md",
      "kind": "file",
      "status": "historical_valid",
      "validator": {
        "kind": "retention_only",
        "path": "scripts/build_artifact_retention_index.py",
        "invocation": "python scripts/build_artifact_retention_index.py --check"
      },
      "reason": "Dated analysis of version, SHA and signature semantics retained as design history rather than an active release attestation.",
      "source_git": true,
      "public_packet": false
    },
    {
      "id": "ART-AUDIT-SELECTED-RAW-20260713",
      "family": "audit",